cohort,school_ID_num,school_name,school_type,program,degree_type,number_people_in_cohort,median_debt,mean_debt
2016_2017,023515,Northern Career Institute,Public,Allied Health and Medical Assisting Services.,Undergraduate Certificate or Diploma,NA,NA,NA
2015_2016,023515,Northern Career Institute,Public,Health and Medical Administrative Services.,Undergraduate Certificate or Diploma,NA,NA,NA
2016_2017,023515,Northern Career Institute,Public,Health and Medical Administrative Services.,Undergraduate Certificate or Diploma,NA,NA,NA
2015_2016,023515,Northern Career Institute,Public,"Practical Nursing, Vocational Nursing and Nursing Assistants.",Undergraduate Certificate or Diploma,16,NA,7582
2016_2017,023515,Northern Career Institute,Public,"Practical Nursing, Vocational Nursing and Nursing Assistants.",Undergraduate Certificate or Diploma,89,9500,8707
